{
    "publicadoEl": "2026-09-06",
    "vigencia": {
        "desde": "2026-09-06",
        "descripcion": "Tarifa ofertada en la adjudicación. El cobro pleno empieza cuando Vialidad Nacional habilite la transitabilidad óptima."
    },
    "moneda": "ARS",
    "alicuotaIva": 0.21,
    "origen": "oferta",
    "tarifas": [
        {
            "categoria": "cat-1",
            "nombre": "Motos",
            "descripcion": "Motocicletas y ciclomotores.",
            "montoSinIva": null,
            "montoConIva": null
        },
        {
            "categoria": "cat-2",
            "nombre": "Autos y camionetas",
            "descripcion": "Vehículos de 2 ejes y hasta 2,10 m de altura.",
            "montoSinIva": 1399.0,
            "montoConIva": 1693.0,
            "nota": "Tarifa ofertada en la adjudicación (Res. 1379/2026)."
        },
        {
            "categoria": "cat-3",
            "nombre": "Autos con remolque y vehículos de 2 ejes de más de 2,10 m",
            "descripcion": "Autos y camionetas con remolque o acoplado; camiones y ómnibus de 2 ejes.",
            "montoSinIva": null,
            "montoConIva": null
        },
        {
            "categoria": "cat-4",
            "nombre": "Camiones y ómnibus de 3 y 4 ejes",
            "descripcion": "Vehículos pesados de 3 o 4 ejes.",
            "montoSinIva": null,
            "montoConIva": null
        },
        {
            "categoria": "cat-5",
            "nombre": "Camiones de 5 y 6 ejes",
            "descripcion": "Vehículos pesados de 5 o 6 ejes.",
            "montoSinIva": null,
            "montoConIva": null
        },
        {
            "categoria": "cat-6",
            "nombre": "Camiones de 7 o más ejes",
            "descripcion": "Vehículos pesados de 7 ejes o más.",
            "montoSinIva": null,
            "montoConIva": null
        }
    ],
    "fuente": {
        "nombre": "Resolución 1379/2026 — Boletín Oficial",
        "url": "https://www.boletinoficial.gob.ar/detalleAviso/primera/346271/20260824"
    },
    "avisos": [
        "Los valores sin dato se publican cuando exista el cuadro homologado."
    ]
}
