{
  "publicadoEl": "2026-10-11",
  "vigencia": {
    "desde": "2026-10-11",
    "descripcion": "Cuadro tarifario vigente desde las 00:00 del domingo 11 de octubre de 2026."
  },
  "moneda": "ARS",
  "alicuotaIva": 0.21,
  "origen": "heredado",
  "cabinas": ["carcarana", "james-craik", "franck"],
  "categoriaDestacada": "cat-1",
  "tarifas": [
    { "categoria": "cat-1", "icono": "auto", "nombre": "Categoría 1", "descripcion": "Vehículos de hasta 2 ejes y hasta 2,30 m de altura, sin rueda doble.", "montoSinIva": 1529.01, "montoConIva": 1850.10, "montoManualSinIva": 1529.01 },
    { "categoria": "cat-2", "icono": "camioneta", "nombre": "Categoría 2", "descripcion": "Hasta 2 ejes y más de 2,30 m de altura y/o con rueda doble; o más de 2 y hasta 4 ejes, menos de 2,30 m, sin rueda doble.", "montoSinIva": 3058.02, "montoConIva": 3700.20, "montoManualSinIva": 3058.02 },
    { "categoria": "cat-3", "icono": "camion-3-4", "nombre": "Categoría 3", "descripcion": "Más de 2 y hasta 4 ejes, más de 2,30 m de altura y/o con rueda doble.", "montoSinIva": 4587.03, "montoConIva": 5550.31, "montoManualSinIva": 4587.03 },
    { "categoria": "cat-4", "icono": "camion-5-6", "nombre": "Categoría 4", "descripcion": "Más de 4 y hasta 6 ejes.", "montoSinIva": 6116.04, "montoConIva": 7400.41, "montoManualSinIva": 6116.04 },
    { "categoria": "cat-5", "icono": "camion-7", "nombre": "Categoría 5", "descripcion": "Más de 6 ejes.", "montoSinIva": 7645.05, "montoConIva": 9250.51, "montoManualSinIva": 7645.05 }
  ],
  "fuente": {
    "nombre": "Covicen S.A., cuadro tarifario vigente desde el 11 de octubre de 2026",
    "url": "https://www.covicen.com.ar/tarifas/"
  },
  "avisos": []
}
